Organism,Lineage
Alcelaphine herpesvirus 1 (strain C500),"Alcelaphine gammaherpesvirus 1, Macavirus, Gammaherpesvirinae, Herpesviridae, Herpesvirales, Herviviricetes, Peploviricota, Heunggongvirae, Duplodnaviria, Viruses"
Streptococcus pyogenes serotype M2 (strain MGAS10270),"Streptococcus pyogenes serotype M2, Streptococcus pyogenes, Streptococcus, Streptococcaceae, Lactobacillales, Bacilli, Firmicutes, Terrabacteria group, Bacteria, cellular organisms"
Euglena gracilis,"Euglena, Euglenaceae, Euglenales, Euglenophyceae, Spirocuta, Euglenida, Euglenozoa, Discoba, Eukaryota, cellular organisms"
Shewanella frigidimarina (strain NCIMB 400),"Shewanella, Shewanellaceae, Alteromonadales, Gammaproteobacteria, Proteobacteria, Bacteria, cellular organisms"
Xylella fastidiosa (strain M12),"Xylella, Xanthomonadaceae, Xanthomonadales, Gammaproteobacteria, Proteobacteria, Bacteria, cellular organisms"
Enterobacteria phage PRD1,"Pseudomonas virus PRD1, Alphatectivirus, Tectiviridae, Kalamavirales, Tectiliviricetes, Preplasmiviricota, Bamfordvirae, Varidnaviria, Viruses"
Chlorokybus atmophyticus,"Chlorokybus, Chlorokybaceae, Chlorokybales, Chlorokybophyceae, Streptophyta, Viridiplantae, Eukaryota, cellular organisms"
Anabaena cylindrica,"Anabaena, Nostocaceae, Nostocales, Cyanobacteria, Cyanobacteria/Melainabacteria group, Terrabacteria group, Bacteria, cellular organisms"
Synechococcus sp. (strain ATCC 27144 / PCC 6301 / SAUG 1402/1),"unclassified Synechococcus, Synechococcus, Synechococcaceae, Synechococcales, Cyanobacteria, Cyanobacteria/Melainabacteria group, Terrabacteria group, Bacteria, cellular organisms"
Cryptococcus gattii serotype B (strain WM276 / ATCC MYA-4071),"Cryptococcus gattii VGII, Cryptococcus gattii species complex, Cryptococcus, Cryptococcaceae, Tremellales, Tremellomycetes, Agaricomycotina, Basidiomycota, Dikarya, Fungi, Opisthokonta, Eukaryota, cellular organisms"
Thermus thermophilus (strain ATCC 27634 / DSM 579 / HB8),"Thermus, Thermaceae, Thermales, Deinococci, Deinococcus-Thermus, Terrabacteria group, Bacteria, cellular organisms"
Felis catus,"Felis, Felinae, Felidae, Feliformia, Carnivora, Laurasiatheria, Boreoeutheria, Eutheria, Theria, Mammalia, Amniota, Tetrapoda, Dipnotetrapodomorpha, Sarcopterygii, Euteleostomi, Teleostomi, Gnathostomata, Vertebrata, Craniata, Chordata, Deuterostomia, Bilateria, Eumetazoa, Metazoa, Opisthokonta, Eukaryota, cellular organisms"
Human adenovirus C serotype 5,"Human mastadenovirus C, Mastadenovirus, Adenoviridae, Rowavirales, Tectiliviricetes, Preplasmiviricota, Bamfordvirae, Varidnaviria, Viruses"
Poinsettia latent virus (isolate Euphorbia pulcherrima/Germany/Siepen/2005),"Polemovirus, Solemoviridae, Sobelivirales, Pisoniviricetes, Pisuviricota, Orthornavirae, Riboviria, Viruses"
Strongylocentrotus purpuratus,"Strongylocentrotus, Strongylocentrotidae, Echinidea, Camarodonta, Echinacea, Euechinoidea, Echinoidea, Echinozoa, Eleutherozoa, Echinodermata, Deuterostomia, Bilateria, Eumetazoa, Metazoa, Opisthokonta, Eukaryota, cellular organisms"
Haemophilus phage HP1 (strain HP1c1),"Hpunavirus, Peduovirinae, Myoviridae, Caudovirales, Caudoviricetes, Uroviricota, Heunggongvirae, Duplodnaviria, Viruses"
Cereibacter sphaeroides,"Cereibacter, Rhodobacteraceae, Rhodobacterales, Alphaproteobacteria, Proteobacteria, Bacteria, cellular organisms"
Wolinella succinogenes (strain ATCC 29543 / DSM 1740 / LMG 7466 / NCTC 11488 / FDC 602W),"Wolinella, Helicobacteraceae, Campylobacterales, Epsilonproteobacteria, delta/epsilon subdivisions, Proteobacteria, Bacteria, cellular organisms"
Fungal sp. (strain NRRL 50135),"unclassified Agaricales, Agaricales, Agaricomycetidae, Agaricomycetes, Agaricomycotina, Basidiomycota, Dikarya, Fungi, Opisthokonta, Eukaryota, cellular organisms"
Komagataella phaffii (strain GS115 / ATCC 20864),"Komagataella, Phaffomycetaceae, Saccharomycetales, Saccharomycetes, Saccharomycotina, saccharomyceta, Ascomycota, Dikarya, Fungi, Opisthokonta, Eukaryota, cellular organisms"
Bacillus anthracis,"Bacillus cereus group, Bacillus, Bacillaceae, Bacillales, Bacilli, Firmicutes, Terrabacteria group, Bacteria, cellular organisms"
Psychrobacter cryohalolentis (strain ATCC BAA-1226 / DSM 17306 / VKM B-2378 / K5),"Psychrobacter, Moraxellaceae, Moraxellales, Gammaproteobacteria, Proteobacteria, Bacteria, cellular organisms"
Chlamydia trachomatis (strain D/UW-3/Cx),"Chlamydia, Chlamydia/Chlamydophila group, Chlamydiaceae, Chlamydiales, Chlamydiia, Chlamydiae, PVC group, Bacteria, cellular organisms"
Mushroom bacilliform virus (isolate Australia/AUS LF-1),"Barnavirus, Barnaviridae, Sobelivirales, Pisoniviricetes, Pisuviricota, Orthornavirae, Riboviria, Viruses"
Burkholderia ambifaria (strain ATCC BAA-244 / AMMD),"Burkholderia cepacia complex, Burkholderia, Burkholderiaceae, Burkholderiales, Betaproteobacteria, Proteobacteria, Bacteria, cellular organisms"
Acidianus two-tailed virus,NotFound
Purpureocillium lilacinum,"Purpureocillium, Ophiocordycipitaceae, Hypocreales, Hypocreomycetidae, Sordariomycetes, sordariomyceta, leotiomyceta, Pezizomycotina, saccharomyceta, Ascomycota, Dikarya, Fungi, Opisthokonta, Eukaryota, cellular organisms"
Amphimedon queenslandica,"Amphimedon, Niphatidae, Haplosclerida, Heteroscleromorpha, Demospongiae, Porifera, Metazoa, Opisthokonta, Eukaryota, cellular organisms"
Penicillium aethiopicum,"Penicillium, Aspergillaceae, Eurotiales, Eurotiomycetidae, Eurotiomycetes, leotiomyceta, Pezizomycotina, saccharomyceta, Ascomycota, Dikarya, Fungi, Opisthokonta, Eukaryota, cellular organisms"
Human adenovirus C serotype 2,"Human mastadenovirus C, Mastadenovirus, Adenoviridae, Rowavirales, Tectiliviricetes, Preplasmiviricota, Bamfordvirae, Varidnaviria, Viruses"
Acidianus bottle-shaped virus (isolate Italy/Pozzuoli),NotFound
Thermosynechococcus vestitus (strain IAM M-273 / NIES-2133 / BP-1),"Thermosynechococcus, Thermosynechococcaceae, Pseudanabaenales, Cyanobacteria, Cyanobacteria/Melainabacteria group, Terrabacteria group, Bacteria, cellular organisms"
Synechococcus elongatus (strain PCC 7942 / FACHB-805),"Synechococcus elongatus, Synechococcus, Synechococcaceae, Synechococcales, Cyanobacteria, Cyanobacteria/Melainabacteria group, Terrabacteria group, Bacteria, cellular organisms"
Drosophila virilis,"virilis group, Drosophila, Drosophila, Drosophilini, Drosophilinae, Drosophilidae, Ephydroidea, Acalyptratae, Schizophora, Cyclorrhapha, Eremoneura, Muscomorpha, Brachycera, Diptera, Endopterygota, Neoptera, Pterygota, Dicondylia, Insecta, Hexapoda, Pancrustacea, Mandibulata, Arthropoda, Panarthropoda, Ecdysozoa, Protostomia, Bilateria, Eumetazoa, Metazoa, Opisthokonta, Eukaryota, cellular organisms"
Leptosphaeria maculans (strain JN3 / isolate v23.1.3 / race Av1-4-5-6-7-8),"Leptosphaeria maculans species complex, Leptosphaeria, Leptosphaeriaceae, Pleosporineae, Pleosporales, Pleosporomycetidae, Dothideomycetes, dothideomyceta, leotiomyceta, Pezizomycotina, saccharomyceta, Ascomycota, Dikarya, Fungi, Opisthokonta, Eukaryota, cellular organisms"
Beauveria bassiana (strain ARSEF 2860),"Beauveria, Cordycipitaceae, Hypocreales, Hypocreomycetidae, Sordariomycetes, sordariomyceta, leotiomyceta, Pezizomycotina, saccharomyceta, Ascomycota, Dikarya, Fungi, Opisthokonta, Eukaryota, cellular organisms"
Chaetomium thermophilum (strain DSM 1495 / CBS 144.50 / IMI 039719),"Chaetomium, Chaetomiaceae, Sordariales, Sordariomycetidae, Sordariomycetes, sordariomyceta, leotiomyceta, Pezizomycotina, saccharomyceta, Ascomycota, Dikarya, Fungi, Opisthokonta, Eukaryota, cellular organisms"
Methanoregula boonei (strain DSM 21154 / JCM 14090 / 6A8),"Methanoregula, Methanoregulaceae, Methanomicrobiales, Methanomicrobia, Stenosarchaea group, Euryarchaeota, Archaea, cellular organisms"
Cereibacter sphaeroides (strain ATCC 17023 / DSM 158 / JCM 6121 / CCUG 31486 / LMG 2827 / NBRC 12203 / NCIMB 8253 / ATH 2.4.1.),"Cereibacter, Rhodobacteraceae, Rhodobacterales, Alphaproteobacteria, Proteobacteria, Bacteria, cellular organisms"
Rhizorhabdus wittichii (strain DSM 6014 / CCUG 31198 / JCM 15750 / NBRC 105917 / EY 4224 / RW1),"Rhizorhabdus, Sphingomonadaceae, Sphingomonadales, Alphaproteobacteria, Proteobacteria, Bacteria, cellular organisms"
Burkholderia mallei (strain ATCC 23344),"pseudomallei group, Burkholderia, Burkholderiaceae, Burkholderiales, Betaproteobacteria, Proteobacteria, Bacteria, cellular organisms"
Amycolatopsis lactamdurans,"Amycolatopsis, Pseudonocardiaceae, Pseudonocardiales, Actinomycetia, Actinobacteria, Terrabacteria group, Bacteria, cellular organisms"
Murid herpesvirus 4,"Rhadinovirus, Gammaherpesvirinae, Herpesviridae, Herpesvirales, Herviviricetes, Peploviricota, Heunggongvirae, Duplodnaviria, Viruses"
Macaca fascicularis,"Macaca, Cercopithecinae, Cercopithecidae, Cercopithecoidea, Catarrhini, Simiiformes, Haplorrhini, Primates, Euarchontoglires, Boreoeutheria, Eutheria, Theria, Mammalia, Amniota, Tetrapoda, Dipnotetrapodomorpha, Sarcopterygii, Euteleostomi, Teleostomi, Gnathostomata, Vertebrata, Craniata, Chordata, Deuterostomia, Bilateria, Eumetazoa, Metazoa, Opisthokonta, Eukaryota, cellular organisms"
Streptomyces mycarofaciens,"Streptomyces, Streptomycetaceae, Streptomycetales, Actinomycetia, Actinobacteria, Terrabacteria group, Bacteria, cellular organisms"
Gibberella fujikuroi (strain CBS 195.34 / IMI 58289 / NRRL A-6831),"Fusarium fujikuroi species complex, Fusarium, Nectriaceae, Hypocreales, Hypocreomycetidae, Sordariomycetes, sordariomyceta, leotiomyceta, Pezizomycotina, saccharomyceta, Ascomycota, Dikarya, Fungi, Opisthokonta, Eukaryota, cellular organisms"
Salmonella typhi,"Salmonella enterica I, Salmonella enterica, Salmonella, Enterobacteriaceae, Enterobacterales, Gammaproteobacteria, Proteobacteria, Bacteria, cellular organisms"
Dugesia japonica,"Dugesia, Dugesiidae, Geoplanoidea, Continenticola, Tricladida, Seriata, Rhabditophora, Platyhelminthes, Lophotrochozoa, Spiralia, Protostomia, Bilateria, Eumetazoa, Metazoa, Opisthokonta, Eukaryota, cellular organisms"
Natronomonas pharaonis (strain ATCC 35678 / DSM 2160 / CIP 103997 / JCM 8858 / NBRC 14720 / NCIMB 2260 / Gabara),"Natronomonas, Haloarculaceae, Halobacteriales, Halobacteria, Stenosarchaea group, Euryarchaeota, Archaea, cellular organisms"
Methylococcus capsulatus (strain ATCC 33009 / NCIMB 11132 / Bath),"Methylococcus, Methylococcaceae, Methylococcales, Gammaproteobacteria, Proteobacteria, Bacteria, cellular organisms"
Ctenocephalides felis,"Ctenocephalides, Archaeopsyllinae, Pulicidae, Pulicoidea, Pulicomorpha, Siphonaptera, Endopterygota, Neoptera, Pterygota, Dicondylia, Insecta, Hexapoda, Pancrustacea, Mandibulata, Arthropoda, Panarthropoda, Ecdysozoa, Protostomia, Bilateria, Eumetazoa, Metazoa, Opisthokonta, Eukaryota, cellular organisms"
Trypanosoma brucei brucei,"Trypanosoma brucei, Trypanozoon, Trypanosoma, Trypanosomatidae, Trypanosomatida, Metakinetoplastina, Kinetoplastea, Euglenozoa, Discoba, Eukaryota, cellular organisms"
Myxoma virus (strain Lausanne),"Leporipoxvirus, Chordopoxvirinae, Poxviridae, Chitovirales, Pokkesviricetes, Nucleocytoviricota, Bamfordvirae, Varidnaviria, Viruses"
Alteromonas mediterranea (strain DSM 17117 / CIP 110805 / LMG 28347 / Deep ecotype),"Alteromonas, Alteromonas/Salinimonas group, Alteromonadaceae, Alteromonadales, Gammaproteobacteria, Proteobacteria, Bacteria, cellular organisms"
Vibrio campbellii (strain ATCC BAA-1116 / BB120),"Vibrio harveyi group, Vibrio, Vibrionaceae, Vibrionales, Gammaproteobacteria, Proteobacteria, Bacteria, cellular organisms"
Plasmodium falciparum (isolate 3D7),"Plasmodium (Laverania), Plasmodium, Plasmodiidae, Haemosporida, Aconoidasida, Apicomplexa, Alveolata, Sar, Eukaryota, cellular organisms"
Acetivibrio thermocellus (strain ATCC 27405 / DSM 1237 / JCM 9322 / NBRC 103400 / NCIMB 10682 / NRRL B-4536 / VPI 7372),"Acetivibrio, Oscillospiraceae, Eubacteriales, Clostridia, Firmicutes, Terrabacteria group, Bacteria, cellular organisms"
Potato virus X (strain Xc),"Potexvirus, Alphaflexiviridae, Tymovirales, Alsuviricetes, Kitrinoviricota, Orthornavirae, Riboviria, Viruses"
Coxiella burnetii (strain RSA 493 / Nine Mile phase I),"Coxiella, Coxiellaceae, Legionellales, Gammaproteobacteria, Proteobacteria, Bacteria, cellular organisms"
Elephas maximus,"Elephas, Elephantidae, Proboscidea, Afrotheria, Eutheria, Theria, Mammalia, Amniota, Tetrapoda, Dipnotetrapodomorpha, Sarcopterygii, Euteleostomi, Teleostomi, Gnathostomata, Vertebrata, Craniata, Chordata, Deuterostomia, Bilateria, Eumetazoa, Metazoa, Opisthokonta, Eukaryota, cellular organisms"
Crassostrea gigas,"Crassostrea, Ostreidae, Ostreoidea, Ostreida, Pteriomorphia, Autobranchia, Bivalvia, Mollusca, Lophotrochozoa, Spiralia, Protostomia, Bilateria, Eumetazoa, Metazoa, Opisthokonta, Eukaryota, cellular organisms"
Prochlorococcus marinus (strain MIT 9303),"Prochlorococcus, Prochlorococcaceae, Synechococcales, Cyanobacteria, Cyanobacteria/Melainabacteria group, Terrabacteria group, Bacteria, cellular organisms"
Influenza A virus (strain A/Teal/China/2978.1/2002 H5N1 genotype W),"Alphainfluenzavirus, Orthomyxoviridae, Articulavirales, Insthoviricetes, Polyploviricotina, Negarnaviricota, Orthornavirae, Riboviria, Viruses"
Rhodospirillum rubrum (strain ATCC 11170 / ATH 1.1.1 / DSM 467 / LMG 4362 / NCIMB 8255 / S1),"Rhodospirillum, Rhodospirillaceae, Rhodospirillales, Alphaproteobacteria, Proteobacteria, Bacteria, cellular organisms"
Rosa hybrid cultivar,"Rosa, Rosoideae incertae sedis, Rosoideae, Rosaceae, Rosales, fabids, rosids, Pentapetalae, Gunneridae, eudicotyledons, Mesangiospermae, Magnoliopsida, Spermatophyta, Euphyllophyta, Tracheophyta, Embryophyta, Streptophytina, Streptophyta, Viridiplantae, Eukaryota, cellular organisms"
Brucella ovis (strain ATCC 25840 / 63/290 / NCTC 10512),"Brucella, Brucella/Ochrobactrum group, Brucellaceae, Hyphomicrobiales, Alphaproteobacteria, Proteobacteria, Bacteria, cellular organisms"
Cornu aspersum,"Cornu, Cornu, Helicidae, Helicoidea, Helicina, Stylommatophora, Eupulmonata, Panpulmonata, Euthyneura, Heterobranchia, Gastropoda, Mollusca, Lophotrochozoa, Spiralia, Protostomia, Bilateria, Eumetazoa, Metazoa, Opisthokonta, Eukaryota, cellular organisms"
Apis mellifera ligustica,"Apis mellifera, Apis, Apini, Apinae, Apidae, Apoidea, Aculeata, Apocrita, Hymenoptera, Endopterygota, Neoptera, Pterygota, Dicondylia, Insecta, Hexapoda, Pancrustacea, Mandibulata, Arthropoda, Panarthropoda, Ecdysozoa, Protostomia, Bilateria, Eumetazoa, Metazoa, Opisthokonta, Eukaryota, cellular organisms"
Streptococcus pyogenes serotype M5 (strain Manfredo),"Streptococcus pyogenes serotype M5, Streptococcus pyogenes, Streptococcus, Streptococcaceae, Lactobacillales, Bacilli, Firmicutes, Terrabacteria group, Bacteria, cellular organisms"
Strawberry mild yellow edge-associated virus,NotFound
Rhizobium leguminosarum bv. viciae,"Rhizobium leguminosarum, Rhizobium, Rhizobium/Agrobacterium group, Rhizobiaceae, Hyphomicrobiales, Alphaproteobacteria, Proteobacteria, Bacteria, cellular organisms"
Turkey rhinotracheitis virus,"Avian metapneumovirus, Metapneumovirus, Pneumoviridae, Mononegavirales, Monjiviricetes, Haploviricotina, Negarnaviricota, Orthornavirae, Riboviria, Viruses"
Xanthomonas phage phiLf,"unclassified Inoviridae, Inoviridae, Tubulavirales, Faserviricetes, Hofneiviricota, Loebvirae, Monodnaviria, Viruses"
Leuconostoc gelidum subsp. gasicomitatum (strain DSM 15947 / CCUG 46042 / CECT 5767 / JCM 12535 / LMG 18811 / NBRC 113245 / TB1-10),"Leuconostoc gelidum, Leuconostoc, Lactobacillaceae, Lactobacillales, Bacilli, Firmicutes, Terrabacteria group, Bacteria, cellular organisms"
Lacticaseibacillus casei (strain BL23),"Lactobacillus casei, Lacticaseibacillus, Lactobacillaceae, Lactobacillales, Bacilli, Firmicutes, Terrabacteria group, Bacteria, cellular organisms"
Aeromonas hydrophila,"Aeromonas, Aeromonadaceae, Aeromonadales, Gammaproteobacteria, Proteobacteria, Bacteria, cellular organisms"
Roseobacter denitrificans (strain ATCC 33942 / OCh 114),"Roseobacter, Roseobacteraceae, Rhodobacterales, Alphaproteobacteria, Proteobacteria, Bacteria, cellular organisms"
Cuscuta gronovii,"Cuscuta sect. Oxycarpae, Cuscuta subgen. Grammica, Cuscuta, Cuscuteae, Convolvulaceae, Solanales, lamiids, asterids, Pentapetalae, Gunneridae, eudicotyledons, Mesangiospermae, Magnoliopsida, Spermatophyta, Euphyllophyta, Tracheophyta, Embryophyta, Streptophytina, Streptophyta, Viridiplantae, Eukaryota, cellular organisms"
Streptococcus pyogenes,"Streptococcus, Streptococcaceae, Lactobacillales, Bacilli, Firmicutes, Terrabacteria group, Bacteria, cellular organisms"
Penicillium expansum,"Penicillium, Aspergillaceae, Eurotiales, Eurotiomycetidae, Eurotiomycetes, leotiomyceta, Pezizomycotina, saccharomyceta, Ascomycota, Dikarya, Fungi, Opisthokonta, Eukaryota, cellular organisms"
Grapevine leafroll-associated virus 3 (isolate United States/NY1),NotFound
Murid herpesvirus 1 (strain Smith),"Muromegalovirus, Betaherpesvirinae, Herpesviridae, Herpesvirales, Herviviricetes, Peploviricota, Heunggongvirae, Duplodnaviria, Viruses"
Mesocricetus auratus,"Mesocricetus, Cricetinae, Cricetidae, Muroidea, Myomorpha, Rodentia, Glires, Euarchontoglires, Boreoeutheria, Eutheria, Theria, Mammalia, Amniota, Tetrapoda, Dipnotetrapodomorpha, Sarcopterygii, Euteleostomi, Teleostomi, Gnathostomata, Vertebrata, Craniata, Chordata, Deuterostomia, Bilateria, Eumetazoa, Metazoa, Opisthokonta, Eukaryota, cellular organisms"
Fowlpox virus (strain NVSL),"Avipoxvirus, Chordopoxvirinae, Poxviridae, Chitovirales, Pokkesviricetes, Nucleocytoviricota, Bamfordvirae, Varidnaviria, Viruses"
Infectious salmon anemia virus (isolate Atlantic salmon/Norway/810/9/99),"Salmon isavirus, Isavirus, Orthomyxoviridae, Articulavirales, Insthoviricetes, Polyploviricotina, Negarnaviricota, Orthornavirae, Riboviria, Viruses"
Maricaulis maris (strain MCS10),"Maricaulis, Maricaulaceae, Maricaulales, Alphaproteobacteria, Proteobacteria, Bacteria, cellular organisms"
Cupriavidus necator (strain ATCC 17699 / DSM 428 / KCTC 22496 / NCIMB 10442 / H16 / Stanier 337),"Cupriavidus necator, Cupriavidus, Burkholderiaceae, Burkholderiales, Betaproteobacteria, Proteobacteria, Bacteria, cellular organisms"
Candida tropicalis (strain ATCC MYA-3404 / T1),"Candida, Candida/Lodderomyces clade, Debaryomycetaceae, Saccharomycetales, Saccharomycetes, Saccharomycotina, saccharomyceta, Ascomycota, Dikarya, Fungi, Opisthokonta, Eukaryota, cellular organisms"
Enterobacter sp. (strain 638),"unclassified Enterobacter, Enterobacter, Enterobacteriaceae, Enterobacterales, Gammaproteobacteria, Proteobacteria, Bacteria, cellular organisms"
Bacillus subtilis,"Bacillus subtilis group, Bacillus, Bacillaceae, Bacillales, Bacilli, Firmicutes, Terrabacteria group, Bacteria, cellular organisms"
Plasmodium berghei (strain Anka),"Plasmodium (Vinckeia), Plasmodium, Plasmodiidae, Haemosporida, Aconoidasida, Apicomplexa, Alveolata, Sar, Eukaryota, cellular organisms"
Pelotomaculum thermopropionicum (strain DSM 13744 / JCM 10971 / SI),"Pelotomaculum, Peptococcaceae, Eubacteriales, Clostridia, Firmicutes, Terrabacteria group, Bacteria, cellular organisms"
Actinobacillus succinogenes (strain ATCC 55618 / DSM 22257 / CCUG 43843 / 130Z),"Actinobacillus, Pasteurellaceae, Pasteurellales, Gammaproteobacteria, Proteobacteria, Bacteria, cellular organisms"
Corynebacterium diphtheriae (strain ATCC 700971 / NCTC 13129 / Biotype gravis),"Corynebacterium, Corynebacteriaceae, Corynebacteriales, Actinomycetia, Actinobacteria, Terrabacteria group, Bacteria, cellular organisms"
Pelodictyon phaeoclathratiforme (strain DSM 5477 / BU-1),"Pelodictyon, Chlorobium/Pelodictyon group, Chlorobiaceae, Chlorobiales, Chlorobia, Chlorobi, Bacteroidetes/Chlorobi group, FCB group, Bacteria, cellular organisms"
Synechococcus sp. (strain JA-2-3B'a(2-13)),"unclassified Synechococcus, Synechococcus, Synechococcaceae, Synechococcales, Cyanobacteria, Cyanobacteria/Melainabacteria group, Terrabacteria group, Bacteria, cellular organisms"
Salmonella typhimurium (strain SL1344),"Salmonella enterica I, Salmonella enterica, Salmonella, Enterobacteriaceae, Enterobacterales, Gammaproteobacteria, Proteobacteria, Bacteria, cellular organisms"
Leptospira interrogans serogroup Icterohaemorrhagiae serovar Lai (strain 56601),"Leptospira interrogans serovar Lai, Leptospira interrogans, Leptospira, Leptospiraceae, Leptospirales, Spirochaetia, Spirochaetes, Bacteria, cellular organisms"
Petrotoga mobilis (strain DSM 10674 / SJ95),"Petrotoga, Petrotogaceae, Petrotogales, Thermotogae, Thermotogae, Bacteria, cellular organisms"
Klebsiella pneumoniae,"Klebsiella, Klebsiella/Raoultella group, Enterobacteriaceae, Enterobacterales, Gammaproteobacteria, Proteobacteria, Bacteria, cellular organisms"
Ignicoccus hospitalis (strain KIN4/I / DSM 18386 / JCM 14125),"Ignicoccus, Desulfurococcaceae, Desulfurococcales, Thermoprotei, Crenarchaeota, TACK group, Archaea, cellular organisms"
Streptococcus agalactiae serotype III (strain NEM316),"Streptococcus agalactiae serogroup III, Streptococcus agalactiae, Streptococcus, Streptococcaceae, Lactobacillales, Bacilli, Firmicutes, Terrabacteria group, Bacteria, cellular organisms"
Schizophyllum commune,"Schizophyllum, Schizophyllaceae, Agaricales, Agaricomycetidae, Agaricomycetes, Agaricomycotina, Basidiomycota, Dikarya, Fungi, Opisthokonta, Eukaryota, cellular organisms"
Streptomyces davaonensis (strain DSM 101723 / JCM 4913 / KCC S-0913 / 768),"Streptomyces, Streptomycetaceae, Streptomycetales, Actinomycetia, Actinobacteria, Terrabacteria group, Bacteria, cellular organisms"
Caulobacter vibrioides (strain ATCC 19089 / CB15),"Caulobacter, Caulobacteraceae, Caulobacterales, Alphaproteobacteria, Proteobacteria, Bacteria, cellular organisms"
Solidesulfovibrio magneticus (strain ATCC 700980 / DSM 13731 / RS-1),"Solidesulfovibrio, Desulfovibrionaceae, Desulfovibrionales, Deltaproteobacteria, delta/epsilon subdivisions, Proteobacteria, Bacteria, cellular organisms"
Lentilactobacillus buchneri (strain NRRL B-30929),"Lentilactobacillus, Lactobacillaceae, Lactobacillales, Bacilli, Firmicutes, Terrabacteria group, Bacteria, cellular organisms"
Equine herpesvirus 1 (strain Ab4p),"Equid alphaherpesvirus 1, Varicellovirus, Alphaherpesvirinae, Herpesviridae, Herpesvirales, Herviviricetes, Peploviricota, Heunggongvirae, Duplodnaviria, Viruses"
Dothistroma septosporum (strain NZE10 / CBS 128990),"Dothistroma, Mycosphaerellaceae, Mycosphaerellales, Dothideomycetidae, Dothideomycetes, dothideomyceta, leotiomyceta, Pezizomycotina, saccharomyceta, Ascomycota, Dikarya, Fungi, Opisthokonta, Eukaryota, cellular organisms"
Lacticaseibacillus casei (strain LC2W),"Lactobacillus casei, Lacticaseibacillus, Lactobacillaceae, Lactobacillales, Bacilli, Firmicutes, Terrabacteria group, Bacteria, cellular organisms"
Lactococcus lactis subsp. cremoris,"Lactococcus, Streptococcaceae, Lactobacillales, Bacilli, Firmicutes, Terrabacteria group, Bacteria, cellular organisms"
Legionella pneumophila subsp. pneumophila (strain Philadelphia 1 / ATCC 33152 / DSM 7513),"Legionella pneumophila, Legionella, Legionellaceae, Legionellales, Gammaproteobacteria, Proteobacteria, Bacteria, cellular organisms"
Phoma sp. (strain ATCC 20986 / MF5453),"unclassified Phoma, Phoma, Didymellaceae, Pleosporineae, Pleosporales, Pleosporomycetidae, Dothideomycetes, dothideomyceta, leotiomyceta, Pezizomycotina, saccharomyceta, Ascomycota, Dikarya, Fungi, Opisthokonta, Eukaryota, cellular organisms"
Desulfovibrio vulgaris subsp. vulgaris (strain DP4),"Desulfovibrio vulgaris, Desulfovibrio, Desulfovibrionaceae, Desulfovibrionales, Deltaproteobacteria, delta/epsilon subdivisions, Proteobacteria, Bacteria, cellular organisms"
Ruegeria pomeroyi (strain ATCC 700808 / DSM 15171 / DSS-3),"Ruegeria, Roseobacteraceae, Rhodobacterales, Alphaproteobacteria, Proteobacteria, Bacteria, cellular organisms"
Halothiobacillus neapolitanus (strain ATCC 23641 / c2),"Halothiobacillus, Halothiobacillaceae, Chromatiales, Gammaproteobacteria, Proteobacteria, Bacteria, cellular organisms"
Rhizobium meliloti,"Sinorhizobium, Sinorhizobium/Ensifer group, Rhizobiaceae, Hyphomicrobiales, Alphaproteobacteria, Proteobacteria, Bacteria, cellular organisms"
Sulfolobus acidocaldarius (strain ATCC 33909 / DSM 639 / JCM 8929 / NBRC 15157 / NCIMB 11770),"Sulfolobus, Sulfolobaceae, Sulfolobales, Thermoprotei, Crenarchaeota, TACK group, Archaea, cellular organisms"
Schistosoma mansoni,"Schistosoma, Schistosomatidae, Schistosomatoidea, Strigeidida, Digenea, Trematoda, Platyhelminthes, Lophotrochozoa, Spiralia, Protostomia, Bilateria, Eumetazoa, Metazoa, Opisthokonta, Eukaryota, cellular organisms"
Polaromonas sp. (strain JS666 / ATCC BAA-500),"environmental samples, Polaromonas, Comamonadaceae, Burkholderiales, Betaproteobacteria, Proteobacteria, Bacteria, cellular organisms"
Mycolicibacterium smegmatis (strain MKD8),"Mycolicibacterium, Mycobacteriaceae, Corynebacteriales, Actinomycetia, Actinobacteria, Terrabacteria group, Bacteria, cellular organisms"
Branchiostoma floridae,"Branchiostoma, Branchiostomidae, Amphioxiformes, Leptocardii, Cephalochordata, Chordata, Deuterostomia, Bilateria, Eumetazoa, Metazoa, Opisthokonta, Eukaryota, cellular organisms"
Protochlamydia amoebophila (strain UWE25),"Candidatus Protochlamydia amoebophila, Candidatus Protochlamydia, Parachlamydiaceae, Parachlamydiales, Chlamydiia, Chlamydiae, PVC group, Bacteria, cellular organisms"
Bigelowiella natans,"Bigelowiella, Chlorarachniophyceae, Cercozoa, Rhizaria, Sar, Eukaryota, cellular organisms"
Fusarium heterosporum,"Fusarium heterosporum species complex, Fusarium, Nectriaceae, Hypocreales, Hypocreomycetidae, Sordariomycetes, sordariomyceta, leotiomyceta, Pezizomycotina, saccharomyceta, Ascomycota, Dikarya, Fungi, Opisthokonta, Eukaryota, cellular organisms"
Pseudomonas sp. (strain NS671),"unclassified Pseudomonas, Pseudomonas, Pseudomonadaceae, Pseudomonadales, Gammaproteobacteria, Proteobacteria, Bacteria, cellular organisms"
