,Organism
1311,Chloroherpeton thalassium (strain ATCC 35110 / GB-78)
1312,Trichoplax adhaerens (Trichoplax reptans)
1313,Lactobacillus casei (strain BL23)
1314,Drosophila persimilis (Fruit fly)
1315,Drosophila willistoni (Fruit fly)
1316,Phenylobacterium zucineum (strain HLK1)
1317,Alteromonas mediterranea (strain DSM 17117 / CIP 110805 / LMG 28347 / Deep ecotype)
1318,Prosthecochloris aestuarii (strain DSM 271 / SK 413)
1319,Pelodictyon phaeoclathratiforme (strain DSM 5477 / BU-1)
1320,Hydrogenobaculum sp. (strain Y04AAS1)
1321,Anaeromyxobacter sp. (strain K)
1322,Synechococcus sp. (strain ATCC 29403 / PCC 7335)
1323,Sputnik virophage
1324,Claviceps purpurea (Ergot fungus) (Sphacelia segetum)
1325,Geobacter bemidjiensis (strain Bem / ATCC BAA-1014 / DSM 16622)
1326,Borrelia duttonii (strain Ly)
1327,Saccharomyces cerevisiae (strain AWRI1631) (Baker's yeast)
1328,Salmo salar (Atlantic salmon)
1329,Klebsiella pneumoniae (strain 342)
1330,Dictyoglomus thermophilum (strain ATCC 35947 / DSM 3960 / H-6-12)
1331,Thermodesulfovibrio yellowstonii (strain ATCC 51303 / DSM 11347 / YP87)
1332,Escherichia coli O157:H7 (strain EC4115 / EHEC)
1333,Penicillium rubens (strain ATCC 28089 / DSM 1075 / NRRL 1951 / Wisconsin 54-1255) (Penicillium chrysogenum)
1334,Rhodospirillum centenum (strain ATCC 51521 / SW)
1335,Schizosaccharomyces japonicus (strain yFS275 / FY16936) (Fission yeast)
1336,Toxoplasma gondii (strain ATCC 50861 / VEG)
1337,Talaromyces marneffei (strain ATCC 18224 / CBS 334.59 / QM 7333) (Penicillium marneffei)
1338,Azobacteroides pseudotrichonymphae genomovar. CFP2
1339,Thermococcus onnurineus (strain NA1)
1340,Bifidobacterium longum subsp. infantis (strain ATCC 15697 / DSM 20088 / JCM 1222 / NCTC 11817 / S12)
1341,Thermosipho africanus (strain TCF52B)
1342,Buchnera aphidicola subsp. Acyrthosiphon pisum (strain Tuc7)
1343,Desulfovibrio vulgaris (strain DSM 19637 / Miyazaki F)
1344,Bifidobacterium animalis subsp. lactis (strain AD011)
1345,Chloroflexus aggregans (strain MD-66 / DSM 9485)
1346,Caulobacter vibrioides (strain NA1000 / CB15N) (Caulobacter crescentus)
1347,Cyanothece sp. (strain PCC 7425 / ATCC 29141)
1348,Ruminiclostridium cellulolyticum (strain ATCC 35319 / DSM 5812 / JCM 6584 / H10) (Clostridium cellulolyticum)
1349,Talaromyces stipitatus (strain ATCC 10500 / CBS 375.48 / QM 6759 / NRRL 1006) (Penicillium stipitatum)
1350,Aspergillus flavus (strain ATCC 200026 / FGSC A1120 / IAM 13836 / NRRL 3357 / JCM 12722 / SRRC 167)
1351,Mycobacterium leprae (strain Br4923)
1352,Clostridium kluyveri (strain NBRC 12016)
1353,Macrococcus caseolyticus (strain JCSC5402)
1354,Populus trichocarpa (Western balsam poplar) (Populus balsamifera subsp. trichocarpa)
1355,Anaplasma marginale (strain Florida)
1356,Halorubrum lacusprofundi (strain ATCC 49239 / DSM 5036 / JCM 8891 / ACAM 34)
1357,Geobacter daltonii (strain DSM 22248 / JCM 15807 / FRC-32)
1358,Ricinus communis (Castor bean)
1359,Human cytomegalovirus (strain Towne) (HHV-5) (Human herpesvirus 5)
1360,Candida dubliniensis (strain CD36 / ATCC MYA-646 / CBS 7987 / NCPF 3949 / NRRL Y-17841) (Yeast)
1361,Neosartorya fumigata (Aspergillus fumigatus)
1362,Pichia angusta (Yeast) (Hansenula polymorpha)
1363,Pinctada fucata (Akoya pearl oyster) (Pinctada imbricata fucata)
1364,Ajellomyces capsulatus (strain G186AR / H82 / ATCC MYA-2454 / RMSCC 2432) (Darling's disease fungus) (Histoplasma capsulatum)
1365,Brevibacillus brevis (strain 47 / JCM 6285 / NBRC 100599)
1366,Rhodococcus erythropolis (strain PR4 / NBRC 100887)
1367,Deinococcus deserti (strain DSM 17065 / CIP 109153 / LMG 22923 / VCD115)
1368,Micromonas commoda (strain RCC299 / NOUM17 / CCMP2709) (Picoplanktonic green alga)
1369,Acidobacterium capsulatum (strain ATCC 51196 / DSM 11244 / BCRC 80197 / JCM 7670 / NBRC 15755 / NCIMB 13165 / 161)
1370,Paracoccidioides brasiliensis (strain Pb18)
1371,Halorubrum pleomorphic virus 1 (HRPV-1)
1372,Listeria monocytogenes serotype 4b (strain CLIP80459)
1373,Pseudomonas fluorescens (strain SBW25)
1374,Vibrio cholerae serotype O1 (strain M66-2)
1375,Sulfolobus islandicus (strain L.S.2.15 / Lassen #1)
1376,Sulfolobus islandicus (strain M.14.25 / Kamchatka #1)
1377,Rickettsia africae (strain ESF-5)
1378,Uncinocarpus reesii (strain UAMH 1704)
1379,Hamiltonella defensa subsp. Acyrthosiphon pisum (strain 5AT)
1380,Corynebacterium kroppenstedtii (strain DSM 44385 / JCM 11950 / CIP 105744 / CCUG 35717)
1381,Chlamydia trachomatis serovar B (strain TZ1A828/OT)
1382,Komagataella phaffii (strain GS115 / ATCC 20864) (Yeast) (Pichia pastoris)
1383,Desulfovibrio magneticus (strain ATCC 700980 / DSM 13731 / RS-1)
1384,Clavispora lusitaniae (strain ATCC 42720) (Yeast) (Candida lusitaniae)
1385,Thermococcus gammatolerans (strain DSM 15229 / JCM 11827 / EJ3)
1386,Edwardsiella ictaluri (strain 93-146)
1387,Teredinibacter turnerae (strain ATCC 39867 / T7901)
1388,Micrococcus luteus (strain ATCC 4698 / DSM 20030 / JCM 1464 / NBRC 3333 / NCIMB 9278 / NCTC 2665 / VKM Ac-2230) (Micrococcus lysodeikticus)
1389,Lachancea thermotolerans (strain ATCC 56472 / CBS 6340 / NRRL Y-8284) (Yeast) (Kluyveromyces thermotolerans)
1390,Zygosaccharomyces rouxii (strain ATCC 2623 / CBS 732 / NBRC 1130 / NCYC 568 / NRRL Y-229) (Candida mogii)
1391,Physarum polycephalum (Slime mold)
1392,Blastomyces gilchristii (strain SLH14081) (Blastomyces dermatitidis)
1393,Candida tropicalis (strain ATCC MYA-3404 / T1) (Yeast)
1394,Paenibacillus sp. (strain JDR-2)
1395,Pectobacterium carotovorum subsp. carotovorum (strain PC1)
1396,Geobacter sp. (strain M21)
1397,Neorickettsia risticii (strain Illinois)
1398,Hirschia baltica (strain ATCC 49814 / DSM 5838 / IFAM 1418)
1399,Brassica rapa subsp. pekinensis (Chinese cabbage) (Brassica pekinensis)
1400,Lactobacillus rhamnosus (strain ATCC 53103 / GG)
1401,Fusarium vanettenii (strain ATCC MYA-4622 / CBS 123669 / FGSC 9596 / NRRL 45880 / 77-13-4) (Fusarium solani subsp. pisi)
1402,Carassius auratus (Goldfish)
1403,Saccharomyces cerevisiae (strain Lalvin EC1118 / Prise de mousse) (Baker's yeast)
1404,Acinetobacter baumannii (strain ATCC 19606 / DSM 30007 / JCM 6841 / CCUG 19606 / CIP 70.34 / NBRC 109757 / NCIMB 12457 / NCTC 12156 / 81)
1405,Blattabacterium sp. subsp. Periplaneta americana (strain BPLAN) (Periplaneta americana symbiotic bacterium)
1406,Helicobacter pylori (strain 52)
1407,Halothiobacillus neapolitanus (strain ATCC 23641 / c2) (Thiobacillus neapolitanus)
1408,Rhodothermus marinus (strain ATCC 43812 / DSM 4252 / R-10) (Rhodothermus obamensis)
1409,Phytophthora infestans (strain T30-4) (Potato late blight fungus)
1410,Quaranfil virus (isolate QrfV/Tick/Afghanistan/EG_T_377/1968) (QRFV)
1411,Thermobaculum terrenum (strain ATCC BAA-798 / YNP1)
1412,Alternaria brassicicola (Dark leaf spot agent)
1413,Lactococcus lactis subsp. lactis (strain KF147)
1414,Ailuropoda melanoleuca (Giant panda)
1415,Rothia mucilaginosa (strain DY-18) (Stomatococcus mucilaginosus)
1416,Neisseria mucosa
1417,Allochromatium vinosum (strain ATCC 17899 / DSM 180 / NBRC 103801 / NCIMB 10441 / D) (Chromatium vinosum)
1418,Arthroderma benhamiae (strain ATCC MYA-4681 / CBS 112371) (Trichophyton mentagrophytes)
1419,Haloferax volcanii (strain ATCC 29605 / DSM 3757 / JCM 8879 / NBRC 14742 / NCIMB 2012 / VKM B-1768 / DS2) (Halobacterium volcanii)
1420,Erwinia amylovora (strain CFBP1430)
1421,Streptococcus suis (strain GZ1)
1422,Trachipleistophora hominis (Microsporidian parasite)
1423,Fusobacterium nucleatum subsp. nucleatum (strain ATCC 23726 / VPI 4351)
1424,Leuconostoc kimchii (strain IMSNU 11154 / KCTC 2386 / IH25)
1425,Thiomonas arsenitoxydans (strain DSM 22701 / CIP 110005 / 3As)
1426,Bacillus selenitireducens (strain ATCC 700615 / DSM 15326 / MLS10)
1427,Arabidopsis lyrata subsp. lyrata (Lyre-leaved rock-cress)
1428,Penicillium aethiopicum
1429,Clostridium ljungdahlii (strain ATCC 55383 / DSM 13528 / PETC)
1430,Acinetobacter oleivorans (strain JCM 16667 / KCTC 23045 / DR1)
1431,Leuconostoc gelidum subsp. gasicomitatum (strain DSM 15947 / CECT 5767 / JCM 12535 / LMG 18811 / TB1-10)
1432,Tibrogargan virus (strain CS132) (TIBV)
1433,Magnetospirillum magnetotacticum (Aquaspirillum magnetotacticum)
1434,Paenibacillus polymyxa (strain E681)
1435,Bacillus spizizenii (strain ATCC 23059 / NRRL B-14472 / W23) (Bacillus subtilis subsp. spizizenii)
1436,Aspergillus sp. (strain MF297-2)
1437,Methanolacinia petrolearia (strain DSM 11571 / OCM 486 / SEBR 4847) (Methanoplanus petrolearius)
1438,Halomonas elongata (strain ATCC 33173 / DSM 2581 / NBRC 15536 / NCIMB 2198 / 1H9)
1439,Salmonella typhimurium (strain SL1344)
1440,Kalanchoe daigremontiana (Devil's backbone) (Bryophyllum daigremontianum)
1441,Enterobacter lignolyticus (strain SCF1)
1442,Leptosphaeria maculans (strain JN3 / isolate v23.1.3 / race Av1-4-5-6-7-8) (Blackleg fungus) (Phoma lingam)
1443,Methanosaeta harundinacea (strain 6Ac)
1444,Cryptococcus gattii serotype B (strain WM276 / ATCC MYA-4071) (Filobasidiella gattii) (Cryptococcus bacillisporus)
1445,Pantoea sp. (strain At-9b)
1446,Sporisorium reilianum (strain SRZ2) (Maize head smut fungus)
1447,Staphylococcus pseudintermedius (strain ED99)
1448,Enterococcus faecalis (strain 62)
1449,Penicillium brevicompactum
1450,Hordeum vulgare subsp. vulgare (Domesticated barley)
1451,Solibacillus silvestris (strain StLB046) (Bacillus silvestris)
1452,Aerococcus urinae (strain ACS-120-V-Col10a)
1453,Lactobacillus casei (strain LC2W)
1454,Enterococcus faecalis (strain ATCC 47077 / OG1RF)
1455,Streptomyces venezuelae (strain ATCC 10712 / CBS 650.69 / DSM 40230 / JCM 4526 / NBRC 13096 / PD 04745)
1456,Trichophyton rubrum (strain ATCC MYA-4607 / CBS 118892) (Athlete's foot fungus)
1457,Melissococcus plutonius (strain ATCC 35311 / CIP 104052 / LMG 20360 / NCIMB 702443)
1458,Lactobacillus buchneri (strain NRRL B-30929)
1459,Erysipelothrix rhusiopathiae (strain Fujisawa)
1460,Alteromonas naphthalenivorans
1461,Limosilactobacillus reuteri (strain ATCC 55730 / SD2112) (Lactobacillus reuteri)
1462,Weissella koreensis (strain KACC 15510)
1463,Methylomonas methanica (strain MC09)
1464,Haloarcula hispanica (strain ATCC 33960 / DSM 4426 / JCM 8911 / NBRC 102182 / NCIMB 2187 / VKM B-1755)
1465,Trichoderma arundinaceum
1466,Botryotinia fuckeliana (strain B05.10) (Noble rot fungus) (Botrytis cinerea)
1467,Haloquadratum walsbyi (strain DSM 16854 / JCM 12705 / C23)
1468,Hypocrea jecorina (strain QM6a) (Trichoderma reesei)
1469,Chaetomium thermophilum (strain DSM 1495 / CBS 144.50 / IMI 039719)
1470,Botryococcus braunii (Green alga)
1471,Arthrobotrys oligospora (strain ATCC 24927 / CBS 115.81 / DSM 1491) (Nematode-trapping fungus) (Didymozoophaga oligospora)
1472,Aspergillus niger (strain ATCC 1015 / CBS 113.46 / FGSC A1144 / LSHB Ac4 / NCTC 3858a / NRRL 328 / USDA 3528.7)
1473,Milnesium tardigradum (Water bear) (Tardigrade)
1474,Azospira oryzae (strain ATCC BAA-33 / DSM 13638 / PS) (Dechlorosoma suillum)
1475,Rosa hybrid cultivar
1476,Acetobacterium woodii (strain ATCC 29683 / DSM 1030 / JCM 2381 / KCTC 1655 / WB1)
1477,Mycobacterium tuberculosis (strain ATCC 35801 / TMC 107 / Erdman)
1478,Rubrivivax gelatinosus (strain NBRC 100245 / IL144)
1479,Amphimedon queenslandica (Sponge)
1480,Burkholderia pseudomallei (strain 1026b)
1481,Haloferax mediterranei (strain ATCC 33500 / DSM 1411 / JCM 8866 / NBRC 14739 / NCIMB 2177 / R-4) (Halobacterium mediterranei)
1482,Beauveria bassiana (strain ARSEF 2860) (White muscardine disease fungus) (Tritirachium shiotae)
1483,Alethinophid 1 reptarenavirus (isolate AlRrV1/Boa/USA/BC/2009) (Golden Gate virus)
1484,Bordetella pertussis (strain ATCC 9797 / DSM 5571 / NCTC 10739 / 18323)
1485,Aspergillus rugulosus (Emericella rugulosa)
1486,Streptomyces davaonensis (strain DSM 101723 / JCM 4913 / KCC S-0913 / 768)
1487,Malbranchea aurantiaca
1488,Phomopsis amygdali (Fusicoccum amygdali)
1489,Aspergillus versicolor
1490,Solanum tuberosum (Potato)
1491,Gluconobacter japonicus
1492,Dothistroma septosporum (strain NZE10 / CBS 128990) (Red band needle blight fungus) (Mycosphaerella pini)
1493,Cochliobolus heterostrophus (strain C4 / ATCC 48331 / race T) (Southern corn leaf blight fungus) (Bipolaris maydis)
1494,Paramecium primaurelia
1495,Latimeria chalumnae (Coelacanth)
1496,Pneumococcus phage Dp-1 (Bacteriophage Dp-1)
1497,Pseudomonas wisconsinensis
1498,Malonomonas rubra
1499,Lactobacillus helveticus (Lactobacillus suntoryeus)
1500,Rice yellow stunt virus (RYSV) (Rice transitory yellowing virus)
1501,Bovine respiratory syncytial virus (strain 127) (BRS)
1502,Human immunodeficiency virus type 1 group M subtype C (isolate 92BR025) (HIV-1)
1503,Struthio camelus (Common ostrich)
1504,Methanothermobacter thermautotrophicus (strain ATCC 29096 / DSM 1053 / JCM 10044 / NBRC 100330 / Delta H) (Methanobacterium thermoautotrophicum)
1505,Archaeoglobus fulgidus (strain ATCC 49558 / DSM 4304 / JCM 9628 / NBRC 100126 / VC-16)
1506,Streptococcus iniae (Streptococcus shiloi)
1507,Thauera aromatica
1508,Alcelaphine herpesvirus 1 (strain C500) (AlHV-1) (Malignant catarrhal fever virus)
1509,Human respiratory syncytial virus B (strain B1)
1510,Bean yellow dwarf virus (BeYDV)
1511,Faba bean necrotic yellows virus (isolate SV292-88) (FBNYV)
1512,Influenza C virus (strain C/Taylor/1233/1947)
1513,Murid herpesvirus 4 (MuHV-4) (Murine gammaherpesvirus 68)
1514,Cynops pyrrhogaster (Japanese fire-bellied newt) (Molge pyrrhogaster)
1515,N/A
